{
  "event_id": "3f1c9a72-6b48-4d2e-9a15-0c7d4e8b2f31",
  "schema_version": 2,
  "timestamp_ms": 1785715200000,
  "module": "mcp-shield",
  "event_type": "secret_boundary_denial",
  "severity": "critical",
  "details": {
    "subsystem": "secret-boundary",
    "operation_id": "op_fetch_weather",
    "destination_host": "api.weather.example.com",
    "credential_ref": "op://dev-vault/weather/api-key",
    "decision": "Denied",
    "outcome": "NotExecuted",
    "denial_reason": "Authorization policy denied request: Destination host 'api.weather.example.com.evil.test' does not match policy approved host 'api.weather.example.com'",
    "duration_ms": 0,
    "action": "denied"
  },
  "source": "module",
  "tenant_id": "college-demo",
  "agent_id": "research-agent",
  "session_id": "demo-session-01",
  "trace_id": "corr-1785715200000-1000",
  "correlation_id": "corr-1785715200000-1000",
  "resource_type": "operation",
  "resource_id": "op_fetch_weather",
  "outcome": "denied",
  "policy_version": "mcp-shield/1"
}
